{
  "metadata": {
    "name": "strlen",
    "subsystem": "console",
    "entry": "main",
    "description": "Reads a line from stdin and prints how many characters it has (excluding the trailing newline). Generated from the intent 'read a line and print its length'."
  },
  "imports": [
    { "dll": "kernel32.dll", "function": "GetStdHandle" },
    { "dll": "kernel32.dll", "function": "ReadFile" },
    { "dll": "kernel32.dll", "function": "WriteFile" },
    { "dll": "kernel32.dll", "function": "ExitProcess" }
  ],
  "data": [
    { "label": "hStdout", "type": "u64", "value": 0 },
    { "label": "buf", "type": "zeros", "size": 256 },
    { "label": "nread", "type": "u32", "value": 0 },
    { "label": "numbuf", "type": "zeros", "size": 32 },
    { "label": "written", "type": "u32", "value": 0 }
  ],
  "code": [
    {
      "label": "main",
      "instructions": [
        { "op": "mov",  "args": ["ecx", "-11"] },
        { "op": "call", "args": ["import:kernel32.dll!GetStdHandle"] },
        { "op": "mov",  "args": ["qword ptr [data:hStdout]", "rax"] },
        { "op": "mov",  "args": ["ecx", "-10"] },
        { "op": "call", "args": ["import:kernel32.dll!GetStdHandle"] },
        { "op": "mov",  "args": ["rcx", "rax"], "comment": "hStdin" },
        { "op": "lea",  "args": ["rdx", "data:buf"] },
        { "op": "mov",  "args": ["r8d", "256"] },
        { "op": "lea",  "args": ["r9", "data:nread"] },
        { "op": "mov",  "args": ["qword ptr [rsp+32]", "0"] },
        { "op": "call", "args": ["import:kernel32.dll!ReadFile"] },
        { "op": "lea",  "args": ["r10", "data:buf"], "comment": "count characters" },
        { "op": "xor",  "args": ["rax", "rax"], "comment": "count = 0" },
        { "label": "sl_loop" },
        { "op": "movzx", "args": ["ecx", "byte ptr [r10]"] },
        { "op": "test", "args": ["cl", "cl"] },
        { "op": "jz",   "args": ["sl_done"], "comment": "end of input" },
        { "op": "cmp",  "args": ["cl", "10"] },
        { "op": "je",   "args": ["sl_done"], "comment": "newline" },
        { "op": "cmp",  "args": ["cl", "13"] },
        { "op": "je",   "args": ["sl_done"], "comment": "carriage return" },
        { "op": "inc",  "args": ["rax"] },
        { "op": "inc",  "args": ["r10"] },
        { "op": "jmp",  "args": ["sl_loop"] },
        { "label": "sl_done" },
        { "op": "mov",  "args": ["rcx", "rax"] },
        { "op": "call", "args": ["print_uint"] },
        { "op": "mov",  "args": ["ecx", "0"] },
        { "op": "call", "args": ["import:kernel32.dll!ExitProcess"] }
      ]
    },
    {
      "label": "print_uint",
      "instructions": [
        { "op": "mov",  "args": ["rax", "rcx"] },
        { "op": "lea",  "args": ["r10", "data:numbuf"] },
        { "op": "mov",  "args": ["r11", "r10"] },
        { "op": "add",  "args": ["r11", "31"] },
        { "op": "mov",  "args": ["byte ptr [r11]", "10"] },
        { "op": "mov",  "args": ["r9", "10"] },
        { "op": "test", "args": ["rax", "rax"] },
        { "op": "jnz",  "args": ["pu_loop"] },
        { "op": "dec",  "args": ["r11"] },
        { "op": "mov",  "args": ["byte ptr [r11]", "48"] },
        { "op": "jmp",  "args": ["pu_done"] },
        { "label": "pu_loop" },
        { "op": "test", "args": ["rax", "rax"] },
        { "op": "jz",   "args": ["pu_done"] },
        { "op": "xor",  "args": ["rdx", "rdx"] },
        { "op": "div",  "args": ["r9"] },
        { "op": "add",  "args": ["dl", "48"] },
        { "op": "dec",  "args": ["r11"] },
        { "op": "mov",  "args": ["byte ptr [r11]", "dl"] },
        { "op": "jmp",  "args": ["pu_loop"] },
        { "label": "pu_done" },
        { "op": "lea",  "args": ["rax", "data:numbuf"] },
        { "op": "add",  "args": ["rax", "32"] },
        { "op": "sub",  "args": ["rax", "r11"] },
        { "op": "mov",  "args": ["rcx", "qword ptr [data:hStdout]"] },
        { "op": "mov",  "args": ["rdx", "r11"] },
        { "op": "mov",  "args": ["r8", "rax"] },
        { "op": "lea",  "args": ["r9", "data:written"] },
        { "op": "mov",  "args": ["qword ptr [rsp+32]", "0"] },
        { "op": "call", "args": ["import:kernel32.dll!WriteFile"] },
        { "op": "ret" }
      ]
    }
  ]
}
