{
  "metadata": {
    "name": "sum1to100",
    "subsystem": "console",
    "entry": "main",
    "description": "Computes 1+2+...+100 and prints the result (5050). Generated from the intent 'sum the integers from 1 to 100 and print the total'."
  },
  "imports": [
    { "dll": "kernel32.dll", "function": "GetStdHandle" },
    { "dll": "kernel32.dll", "function": "WriteFile" },
    { "dll": "kernel32.dll", "function": "ExitProcess" }
  ],
  "data": [
    { "label": "hStdout", "type": "u64", "value": 0 },
    { "label": "numbuf", "type": "zeros", "size": 32 },
    { "label": "written", "type": "u32", "value": 0 }
  ],
  "code": [
    {
      "label": "main",
      "instructions": [
        { "op": "mov",  "args": ["ecx", "-11"] },
        { "op": "call", "args": ["import:kernel32.dll!GetStdHandle"] },
        { "op": "mov",  "args": ["qword ptr [data:hStdout]", "rax"] },
        { "op": "xor",  "args": ["rax", "rax"], "comment": "sum = 0" },
        { "op": "mov",  "args": ["rcx", "1"], "comment": "i = 1" },
        { "label": "sum_loop" },
        { "op": "cmp",  "args": ["rcx", "100"] },
        { "op": "jg",   "args": ["sum_done"] },
        { "op": "add",  "args": ["rax", "rcx"], "comment": "sum += i" },
        { "op": "inc",  "args": ["rcx"] },
        { "op": "jmp",  "args": ["sum_loop"] },
        { "label": "sum_done" },
        { "op": "mov",  "args": ["rcx", "rax"], "comment": "print the sum" },
        { "op": "call", "args": ["print_uint"] },
        { "op": "mov",  "args": ["ecx", "0"] },
        { "op": "call", "args": ["import:kernel32.dll!ExitProcess"] }
      ]
    },
    {
      "label": "print_uint",
      "instructions": [
        { "op": "mov",  "args": ["rax", "rcx"] },
        { "op": "lea",  "args": ["r10", "data:numbuf"] },
        { "op": "mov",  "args": ["r11", "r10"] },
        { "op": "add",  "args": ["r11", "31"] },
        { "op": "mov",  "args": ["byte ptr [r11]", "10"] },
        { "op": "mov",  "args": ["r9", "10"] },
        { "op": "test", "args": ["rax", "rax"] },
        { "op": "jnz",  "args": ["pu_loop"] },
        { "op": "dec",  "args": ["r11"] },
        { "op": "mov",  "args": ["byte ptr [r11]", "48"] },
        { "op": "jmp",  "args": ["pu_done"] },
        { "label": "pu_loop" },
        { "op": "test", "args": ["rax", "rax"] },
        { "op": "jz",   "args": ["pu_done"] },
        { "op": "xor",  "args": ["rdx", "rdx"] },
        { "op": "div",  "args": ["r9"] },
        { "op": "add",  "args": ["dl", "48"] },
        { "op": "dec",  "args": ["r11"] },
        { "op": "mov",  "args": ["byte ptr [r11]", "dl"] },
        { "op": "jmp",  "args": ["pu_loop"] },
        { "label": "pu_done" },
        { "op": "lea",  "args": ["rax", "data:numbuf"] },
        { "op": "add",  "args": ["rax", "32"] },
        { "op": "sub",  "args": ["rax", "r11"] },
        { "op": "mov",  "args": ["rcx", "qword ptr [data:hStdout]"] },
        { "op": "mov",  "args": ["rdx", "r11"] },
        { "op": "mov",  "args": ["r8", "rax"] },
        { "op": "lea",  "args": ["r9", "data:written"] },
        { "op": "mov",  "args": ["qword ptr [rsp+32]", "0"] },
        { "op": "call", "args": ["import:kernel32.dll!WriteFile"] },
        { "op": "ret" }
      ]
    }
  ]
}
