{
  "metadata": {
    "name": "hello_window",
    "subsystem": "gui",
    "entry": "main",
    "description": "A real Win32 GUI window: RegisterClassEx + CreateWindowEx + message loop."
  },
  "imports": [
    {
      "dll": "kernel32.dll",
      "function": "GetModuleHandleA"
    },
    {
      "dll": "kernel32.dll",
      "function": "ExitProcess"
    },
    {
      "dll": "user32.dll",
      "function": "RegisterClassExA"
    },
    {
      "dll": "user32.dll",
      "function": "CreateWindowExA"
    },
    {
      "dll": "user32.dll",
      "function": "ShowWindow"
    },
    {
      "dll": "user32.dll",
      "function": "UpdateWindow"
    },
    {
      "dll": "user32.dll",
      "function": "GetMessageA"
    },
    {
      "dll": "user32.dll",
      "function": "TranslateMessage"
    },
    {
      "dll": "user32.dll",
      "function": "DispatchMessageA"
    },
    {
      "dll": "user32.dll",
      "function": "DefWindowProcA"
    },
    {
      "dll": "user32.dll",
      "function": "PostQuitMessage"
    },
    {
      "dll": "user32.dll",
      "function": "LoadCursorA"
    }
  ],
  "data": [
    {
      "label": "classname",
      "type": "bytes",
      "value": "Sir Yaps-a-LotWindow\u0000"
    },
    {
      "label": "title",
      "type": "bytes",
      "value": "Hello from a Sir Yaps-a-Lot window!\u0000"
    },
    {
      "label": "wc",
      "type": "zeros",
      "size": 80
    },
    {
      "label": "msg",
      "type": "zeros",
      "size": 48
    }
  ],
  "code": [
    {
      "label": "main",
      "instructions": [
        {
          "op": "xor",
          "args": [
            "ecx",
            "ecx"
          ]
        },
        {
          "op": "call",
          "args": [
            "import:kernel32.dll!GetModuleHandleA"
          ]
        },
        {
          "op": "mov",
          "args": [
            "%v0",
            "rax"
          ],
          "comment": "hInstance"
        },
        {
          "op": "lea",
          "args": [
            "r10",
            "data:wc"
          ]
        },
        {
          "op": "mov",
          "args": [
            "dword ptr [r10]",
            "80"
          ],
          "comment": "cbSize"
        },
        {
          "op": "mov",
          "args": [
            "dword ptr [r10+4]",
            "3"
          ],
          "comment": "CS_HREDRAW|CS_VREDRAW"
        },
        {
          "op": "lea",
          "args": [
            "rax",
            "code:WndProc"
          ]
        },
        {
          "op": "mov",
          "args": [
            "[r10+8]",
            "rax"
          ],
          "comment": "lpfnWndProc"
        },
        {
          "op": "mov",
          "args": [
            "[r10+24]",
            "%v0"
          ],
          "comment": "hInstance"
        },
        {
          "op": "xor",
          "args": [
            "ecx",
            "ecx"
          ]
        },
        {
          "op": "mov",
          "args": [
            "edx",
            "32512"
          ]
        },
        {
          "op": "call",
          "args": [
            "import:user32.dll!LoadCursorA"
          ]
        },
        {
          "op": "lea",
          "args": [
            "r10",
            "data:wc"
          ]
        },
        {
          "op": "mov",
          "args": [
            "[r10+40]",
            "rax"
          ],
          "comment": "hCursor"
        },
        {
          "op": "mov",
          "args": [
            "qword ptr [r10+48]",
            "6"
          ],
          "comment": "hbrBackground"
        },
        {
          "op": "lea",
          "args": [
            "rax",
            "data:classname"
          ]
        },
        {
          "op": "mov",
          "args": [
            "[r10+64]",
            "rax"
          ],
          "comment": "lpszClassName"
        },
        {
          "op": "lea",
          "args": [
            "rcx",
            "data:wc"
          ]
        },
        {
          "op": "call",
          "args": [
            "import:user32.dll!RegisterClassExA"
          ]
        },
        {
          "op": "xor",
          "args": [
            "ecx",
            "ecx"
          ]
        },
        {
          "op": "lea",
          "args": [
            "rdx",
            "data:classname"
          ]
        },
        {
          "op": "lea",
          "args": [
            "r8",
            "data:title"
          ]
        },
        {
          "op": "mov",
          "args": [
            "r9d",
            "0xCF0000"
          ],
          "comment": "WS_OVERLAPPEDWINDOW"
        },
        {
          "op": "mov",
          "args": [
            "dword ptr [rsp+0x20]",
            "0x80000000"
          ],
          "comment": "x=CW_USEDEFAULT"
        },
        {
          "op": "mov",
          "args": [
            "dword ptr [rsp+0x28]",
            "0x80000000"
          ],
          "comment": "y=CW_USEDEFAULT"
        },
        {
          "op": "mov",
          "args": [
            "qword ptr [rsp+0x30]",
            "640"
          ],
          "comment": "width"
        },
        {
          "op": "mov",
          "args": [
            "qword ptr [rsp+0x38]",
            "480"
          ],
          "comment": "height"
        },
        {
          "op": "mov",
          "args": [
            "qword ptr [rsp+0x40]",
            "0"
          ]
        },
        {
          "op": "mov",
          "args": [
            "qword ptr [rsp+0x48]",
            "0"
          ]
        },
        {
          "op": "mov",
          "args": [
            "[rsp+0x50]",
            "%v0"
          ],
          "comment": "hInstance"
        },
        {
          "op": "mov",
          "args": [
            "qword ptr [rsp+0x58]",
            "0"
          ]
        },
        {
          "op": "call",
          "args": [
            "import:user32.dll!CreateWindowExA"
          ]
        },
        {
          "op": "mov",
          "args": [
            "rcx",
            "rax"
          ],
          "comment": "hwnd"
        },
        {
          "op": "mov",
          "args": [
            "edx",
            "10"
          ]
        },
        {
          "op": "call",
          "args": [
            "import:user32.dll!ShowWindow"
          ]
        },
        {
          "op": "mov",
          "args": [
            "rcx",
            "rax"
          ]
        },
        {
          "op": "call",
          "args": [
            "import:user32.dll!UpdateWindow"
          ]
        },
        {
          "label": "msgloop"
        },
        {
          "op": "lea",
          "args": [
            "rcx",
            "data:msg"
          ]
        },
        {
          "op": "xor",
          "args": [
            "edx",
            "edx"
          ]
        },
        {
          "op": "xor",
          "args": [
            "r8d",
            "r8d"
          ]
        },
        {
          "op": "xor",
          "args": [
            "r9d",
            "r9d"
          ]
        },
        {
          "op": "call",
          "args": [
            "import:user32.dll!GetMessageA"
          ]
        },
        {
          "op": "test",
          "args": [
            "eax",
            "eax"
          ]
        },
        {
          "op": "jz",
          "args": [
            "endloop"
          ]
        },
        {
          "op": "lea",
          "args": [
            "rcx",
            "data:msg"
          ]
        },
        {
          "op": "call",
          "args": [
            "import:user32.dll!TranslateMessage"
          ]
        },
        {
          "op": "lea",
          "args": [
            "rcx",
            "data:msg"
          ]
        },
        {
          "op": "call",
          "args": [
            "import:user32.dll!DispatchMessageA"
          ]
        },
        {
          "op": "jmp",
          "args": [
            "msgloop"
          ]
        },
        {
          "label": "endloop"
        },
        {
          "op": "xor",
          "args": [
            "ecx",
            "ecx"
          ]
        },
        {
          "op": "call",
          "args": [
            "import:kernel32.dll!ExitProcess"
          ]
        }
      ]
    },
    {
      "label": "WndProc",
      "instructions": [
        {
          "op": "cmp",
          "args": [
            "edx",
            "2"
          ]
        },
        {
          "op": "jne",
          "args": [
            "wp_def"
          ]
        },
        {
          "op": "mov",
          "args": [
            "ecx",
            "0"
          ]
        },
        {
          "op": "call",
          "args": [
            "import:user32.dll!PostQuitMessage"
          ]
        },
        {
          "op": "xor",
          "args": [
            "eax",
            "eax"
          ]
        },
        {
          "op": "ret",
          "args": []
        },
        {
          "label": "wp_def"
        },
        {
          "op": "call",
          "args": [
            "import:user32.dll!DefWindowProcA"
          ]
        },
        {
          "op": "ret",
          "args": []
        }
      ]
    }
  ]
}